,column_num,sentence,index,overall,cat
354,22145,Sleeves are too small.,22145,2,1
355,22145,"The cut is described as slim it, it should read more like shrink wrap.",22145,2,1
356,22145,When considering this product note: order two to three sizes up from what you would normally wear.,22145,2,1
357,22145,The cufflink buttons are also very cheap and are hard to unbutton.,22145,2,3
358,22146,I usually love PattiBoutik but this dress was a bit of a bummer.,22146,2,-1
359,22146,It was really tight and the fabric was scratchy (think wool socks).,22146,2,3
360,22146,The dress is also really short (it covered my butt with only a few inches to spare).,22146,2,1
361,22146,I usually wear a medium in their shirts but the medium dress was really snug and uncomfortable in the arms.,22146,2,1
362,22147,It's pretty but i got it for myself and its small like it would fit a Child.,22147,2,1
363,22147,i put it on and it was like a choker on me if you like that kind of look,22147,2,1
364,22148,"I ordered this because I needed a white purse to match my shoes but it is more of a tan color, Not white!",22148,2,2
365,22148,I ordered a different one and I hope this one will be white!,22148,2,2
366,22149,Cute but sized way too small.,22149,2,1
367,22149,"Bought a 7, fits like a 5.",22149,2,1
368,22150,I was very disappointed in this dress.,22150,2,-1
370,22150,Going to make it into a dust rag.,22150,2,-1
371,22150,It works better as that than a dress.,22150,2,-1
372,22151,The sizing chart is way off.,22151,2,1
373,22151,This shirt was so small it wouldn't even fit over my head.,22151,2,1
374,22151,Can't return it because it comes from China and took over a month to receive it and is to expense to ship back.,22151,2,0
375,22151,Lesson learned to never order anything from over seas.,22151,2,0
376,22151,Where is all the American made things?,22151,2,-1
377,22152,"I bought these to wear on a daily basis, but after a week I had to take them out.",22152,2,-1
378,22152,Recently they rubbed off and then turned my ears green.,22152,2,3
379,22152,"Nice to wear for a couple of hours, not so nice if you want them as a regular wear.",22152,2,3
380,22153,These would have been the perfect color for a costume I need if they fit.,22153,2,-1
381,22153,They are a good length but you would have to be a twig to squeeze into these leggings.,22153,2,1
382,22154,"It fits the description, but they are ugly..super thick and a weird material.",22154,2,3
383,22154,They will sit in my closet til I can give them away.rough itchy material,22154,2,3
384,22156,Make sure you wash alone inside out...I washed it once and now it is unwearable due to fading...she had worn it once!!!!!,22156,2,3
385,22157,Was too big in bust area and too short.,22157,2,1
386,22157,"I am 5'6"" and the waist band part didn't lay where it should and if I pulled it up to there it was a little to short.",22157,2,1
387,22157,It is silky soft just not proportionate.,22157,2,3
388,22158,"The lace was nice and stretchy, and it really could face been cute, but the collar didn't even wrap the whole way around the neck, and the button to hold it together didn't really do its job...",22158,2,3
389,22158,"There were loops of thread sticking out, as well.",22158,2,3
390,22158,"I suppose these things can be fixed by a tailor, or yourself if you know anything about sewing, and if so, go for it!",22158,2,-1
391,22158,"But otherwise, I don't recommend it.",22158,2,-1
392,22159,"They were beautiful, perfect weight, just right purple color but way too small.",22159,2,-1
393,22159,"I was very disappointed in the fit, so I returned them.",22159,2,-1
394,22159,I ordered 2 other pairs feim 2 other vendors and their size charts were spot on.,22159,2,1
395,22159,This vendor should revisit its size chart.,22159,2,1
396,22160,"Color & style are nice, but not the material I expected.",22160,2,-1
397,22160,Kind of cheap looking,22160,2,3
399,22161,Cheap material broke when I was trying to put it on,22161,2,3
400,22163,I ordered a medium- fit more like a large.,22163,2,1
401,22163,I think I'll like the outfit more once I get it taken in so that it fits properly.,22163,2,1
402,22164,It was much smaller than expected.,22164,2,1
404,22164,Print and fabric very nice.,22164,2,3
405,22164,I ordered XL but it fits my daughter who is a medium.,22164,2,1
406,22165,Size runs smaller than it should,22165,2,1
407,22166,too small and I did not like the material,22166,2,1
408,22167,I don't like.the material  and  it was too long,22167,2,-1
409,22168,It looks like a Halloween costume because of the thin & stretchy material.,22168,2,3
410,22168,I've had it for a few months and still haven't wore it.,22168,2,-1
411,22169,Very tight and uncomfortable and quality lacking .. very thin material,22169,2,3
412,22170,The sizing of the shirt is wrong this shirt is to short,22170,2,1
413,22171,FIRST AND FOREMOST THE SHIRT IS NOT BLACK!!,22171,2,2
414,22171,I received a navy blue plaid shirt which instantly threw me off.,22171,2,2
415,22171,I have purchased this to wear over a number of black outfits for a upcoming trip and sadly now I can't because it doesn't match.,22171,2,2
416,22171,"As for the fit I am 5'0, 160 pounds.",22171,2,1
417,22171,Length wise it was perfect and it fit on the arms but it was just a step away from being too tight.,22171,2,1
418,22171,It does say one size fits all but I would advise anyone with larger arms/wears bigger than a medium in tops not to buy it.,22171,2,1
419,22171,Plus it isn't the right color.,22171,2,2
420,22172,"Two small in the crotch, also ripped in the crotch.",22172,2,1
421,22173,The product does look like the picture and the price was great.,22173,2,3
422,22173,I just was upset to see how thin the material is.,22173,2,3
423,22173,Its not something you could wear in a pool or out for that matter.,22173,2,3
424,22173,I was so upset because after I received this swim suit I didn't have time to find another.,22173,2,-1
425,22173,The only reason I didn't give it one star is because I got exactly what I paid for.,22173,2,-1
426,22173,I wish I would've just spent more money to get something with a better quality.,22173,2,3
427,22174,I bought 5 of them and was very disappointed.,22174,2,-1
428,22174,"Nothing to give an adult, might be good for children, but frankly would not waste your money.",22174,2,3
429,22176,Shipping took a while because it was coming from China.,22176,2,0
430,22176,I received it and the colors were correct (I got the tan color).,22176,2,2
431,22176,I ordered XXL 35-36 waist 46 in the hips.,22176,2,1
432,22176,Everything fits except the waist was baggy.,22176,2,1
433,22176,The material is stretchy.,22176,2,3
434,22176,It feels like a thick t shirt.,22176,2,3
