,column_num,sentence,index,overall,cat
0,22000,"The material feels pretty cheap, not very soft.",22000,2,3
1,22000,Colors and pattern are pretty but the material kind of ruins it.,22000,2,2
2,22001,"I guess the ""fits as described"" reviews were particularly small women.",22001,2,1
3,22001,"Seller was also reluctant to refund due to ""shipping"", gave me a partial refund that was essentially a 30% discount.",22001,2,0
4,22001,Still too expensive for a shirt that may never be worn.,22001,2,3
5,22002,I could tell little or no difference when wearing these.,22002,2,-1
6,22002,They definitely did not measure up to the advertising rhetoric for me.,22002,2,2
7,22003,"PENDANT ON A THREAD, BE CAREFUL!",22003,2,-1
8,22004,"The quality of the fabric feels cheap, definitely not worth the price, even though they fit well.",22004,2,3
9,22004,"I can tell that after a few washes, the fabric would lose its stretch and would fade like a similar pair I bought a few months ago.",22004,2,3
10,22005,I cannot say I am pleased but will keep the dress and hope to wear it sometime.,22005,2,3
11,22005,It is not at all suitable for wearing to my son's wedding.,22005,2,-1
12,22006,"I received rose gold, not yellow gold",22006,2,2
13,22007,Not what I was expecting.,22007,2,2
14,22112,Not what I was expecting.,22112,2,-1
23,22007,I was hoping to get a cute Santa headband for my daughter's Christmas party.,22007,2,3
24,22007,I got sequined antlers and devil horns with Christmas pins glued to it.,22007,2,3
25,22007,I'll contact the company for a replacement.,22007,2,3
26,22008,Doesn't fit like other shirts I bought.,22008,2,1
27,22009,The color of the shirt in the illustration is not what I received.,22009,2,2
28,22009,"It is much darker, and yes, has a pronounced woven pattern.",22009,2,2
29,22009,It is not what I consider a traditional chambray cloth shirt.,22009,2,2
30,22009,"I suppose the advertised text sounds more appealing than than the actual ""Docker's Men's Blue One Pocket Woven Shirt.",22009,2,2
31,22009,Look else where if you want a Chambray shirt.,22009,2,2
32,22010,The purse is spacious but the bottom doesn't have any support to it.,22010,2,3
33,22010,I don't use this purse like I thought I would,22010,2,-1
34,22011,Fits like a large.,22011,2,1
35,22012,Faded after first wear.,22012,2,2
36,22013,It's an X-L but it fits like a medium.,22013,2,1
37,22014,"Although this dress is made of a very soft nylon/spandex material, the fit scale they provide is not accurate at all!",22014,2,1
38,22014,I normally where a size 8 or size medium.,22014,2,1
39,22014,I ordered this in a size large as i read a review that said it ran small.,22014,2,1
40,22014,It was sooo small i could not even get it zipped.,22014,2,1
41,22014,This dress is at least 2 if not 3 sizes smaller than the actual USA sizing it claims.,22014,2,1
42,22014,The USA size large is actually comparable  to a small.,22014,2,1
43,22014,My daughter wears a size 2 and the large fits her beautifully (at least it will be used by someone!,22014,2,1
44,22015,The shirt I got was not like the picture advertized.,22015,2,2
45,22015,I aas expecting to get a huge skull printed shirt with bright pink colors.,22015,2,2
46,22015,What I got was a big black shirt with a small skull patterned and it was even wrong color .,22015,2,2
47,22015,What I got was purple.,22015,2,2
48,22016,Bought this thinking it would be breastfeeding 'friendly' since it has buttons up the front.,22016,2,3
49,22016,"They're fake-as in, the shirt doesn't open with buttons-it's sewn shut.",22016,2,3
50,22016,"Also, as others have mentioned, it's really tight.",22016,2,1
51,22016,"I think if you're a person with curvy hips, don't bother with this one, it's too tight in this area.",22016,2,1
52,22017,Two big-- too unyielding.,22017,2,1
53,22017,Absolutely no structure at all.,22017,2,3
54,22017,I couldn't even figure out how to get it back into the pouch --it went back,22017,2,-1
55,22018,Nice shoe but one would not light up.,22018,2,3
56,22018,"As they were a gift, we did not know until it was past the 30 days to return and now the product is no longer available.",22018,2,-1
57,22019,"Looks just like the picture, but the sizes run insanely small.",22019,2,1
58,22019,"I ordered a large when I normally go small, and it's still too small.",22019,2,1
59,22020,It didn't seem to be sewn straight and was very tight.,22020,2,3
60,22021,Cheap foam not worth the money pieces fell off after second use,22021,2,3
62,22022,They look great but run small.,22022,2,1
63,22023,The bottoms does not match the top but i can mix and match it with other bathing suits I have,22023,2,2
64,22024,I had to return this dress because the neckline was uneven.,22024,2,3
65,22024,"One side of the Vneck was longer than the other, which made the dress lay uneven.",22024,2,3
66,22024,I would not suggest this to anyone.,22024,2,3
67,22025,I wear a women's size 7.,22025,2,1
68,22025,I ordered a men's 5 which is equivalent to a women's 7...they fit like an 8.,22025,2,1
69,22025,I like them but they don't fit.,22025,2,1
70,22025,I'll be returning them...although the box doesn't fit in the package they want them returned in.,22025,2,1
71,22026,"It's not too tight, wished it was longer, I'm only 5'4 and it's still too short, not like the picture",22026,2,1
72,22027,This robe is just as pictured.,22027,2,3
73,22027,"It is NOT LACE, it is made with inexpensive tulle with a lace trim.",22027,2,3
74,22027,"It was not comfortable, it was itchy and if your planning on wearing it for longer than a 30 min foreplay I would suggest soaking it in fabric softener.",22027,2,3
75,22028,I unfortunately didn't try this out until after my return period had ended.,22028,2,3
76,22028,I wear a small and fit into jeans 4-6 so I bought a small.,22028,2,1
77,22028,It only fits 2 inches above the knee.,22028,2,1
78,22028,It can't go any higher.,22028,2,1
79,22028,I also figured this would be really effortless to wear but instead it's bulky enough (without stuff inside it) and my thighs do touch enough that I can feel it rubbing my other thigh when I walk.,22028,2,1
80,22028,In any dress that doesn't have a flared skirt you can see it right through the fabric very obviously.,22028,2,3
81,22028,The black lace is pretty but I thought the pockets would all be within the beige fabric behind it.,22028,2,3
82,22028,Instead only one pocket is like that - for the others you can see the contents behind the lace and in front of the beige fabric.,22028,2,3
83,22028,In my experience wearing it for 20 minutes before I left the house it sagged and didn't seem to hold up on any place on my thigh.,22028,2,3
84,22028,And for the price....well I wish I had figured this out in time to send it back.,22028,2,-1
85,22028,I ended up buying a small crossbody for going out - more effective.,22028,2,1
86,22029,The material was is very stiff.,22029,2,3
87,22029,Not good for children.,22029,2,-1
88,22029,Was way to small.,22029,2,1
89,22030,Poor quality shirt cool design,22030,2,3
90,22031,not what I expected,22031,2,-1
97,22032,This jacket does not fit as it looks in the photo.,22032,2,1
98,22032,I spent another $45.- to try and get it to look like I expected.,22032,2,2
99,22032,I could have just spent $100.- and gotten a really nice jacket.,22032,2,2
100,22033,The material is somewhat of a stretchy jean.the dress didn't look nothing like the picture,22033,2,3
101,22034,"However, these are listed as size ""Adult"" and say 14+ on the package.",22034,2,1
102,22034,They don't actually fit an adult.,22034,2,1
103,22034,"They fit my 8 year old ""perfectly"".",22034,2,1
104,22035,I would have easily give 5 stars for this sweater because it looks so cute and exactly what I was looking for to wear with my brown leggings and brown boots.,22035,2,2
105,22035,"However, when I opened the package and tried on, I noticed a hole in the left pocket and the hem along the bottom is coming apart.",22035,2,3
106,22035,I've only worn once because I am scared to wash thinking it will completely fall apart.,22035,2,3
107,22035,"It's too bad the quality was poor since the look, color, and design of this sweater is great!",22035,2,-1
108,22036,The gem fellout within a week otherwise i loved it,22036,2,3
109,22038,"You get what you pay for, but my shorts were sewed together when they sewed the buttons on.",22038,2,3
110,22038,I had to fix my shorts before I could wear them.,22038,2,3
111,22039,"Took over a week to ship, when I finally received it the size was more like a kids size instead of an adult medium",22039,2,0
112,22040,Bottom fit very full and made me look much larger than I am.,22040,2,1
114,22040,"I liked the corset-like top, but isn't sturdy enough to stand up on it's own.",22040,2,1
116,22040,Red velvet had bad creases after a few minutes of wear.,22040,2,3
118,22041,These are not nylon they are thick black socks.,22041,2,3
119,22041,Not like the picture at all.,22041,2,2
121,22041,Still they fit as expected and do the job they are made for,22041,2,1
122,22042,"I will give it to my daughter , it fits little tight on me.",22042,2,1
123,22043,broke before i had a chance to try it on - clasp came off in my hand!,22043,2,3
124,22044,"Hides tummy well, easy to put on.",22044,2,1
125,22044,But I do not like the way my butt looks in it.,22044,2,1
126,22044,"It does lift my butt, but it also makes the shape look weird.",22044,2,1
127,22044,I do have a big bottom so maybe that's it,22044,2,-1
128,22045,"too small, some scratches on the leather",22045,2,-1
129,22046,Size was not what I hoping for.,22046,2,1
130,22047,I love the style of this jacket but the size's run's very small.,22047,2,1
131,22048,NICE BUT TOO SMALL,22048,2,1
132,22049,Very thin and does not drape the way it looks in the picture,22049,2,3
133,22050,Pretty dress however I did not care for the top for the reason being it wasn't cut very neatly.,22050,2,3
134,22051,Brim is good but can't tighten it enough with string in back.,22051,2,3
135,22051,Material for tightening doesn't hold in place.,22051,2,3
136,22051,We are considering returning it.,22051,2,-1
137,22052,"You can't beat the price but if you are buying this for a watch you are going to wear every day, you may want to reconsider.",22052,2,-1
138,22052,"It itches, and after about a week and a half I had a rash underneath the band.",22052,2,3
139,22053,not as i  thought it would fit,22053,2,1
140,22054,Is quite a bit bigger than I expected and short as well.,22054,2,1
141,22055,These are very pretty and very delicate.,22055,2,3
142,22055,After wearing for a only few days they broke.,22055,2,3
143,22055,I did take them out will sleeping and showering.,22055,2,-1
144,22055,Kinda bummed because I really liked them.,22055,2,-1
145,22056,Reviews are right.. way too small and I don't know how I could even wear this all day.,22056,2,1
147,22056,"Material is SO rigid and has no give which I understand why, but I wish there was some elasticity in it.",22056,2,3
149,22056,Will be returning this item,22056,2,-1
151,22057,Did not fit as expected,22057,2,1
152,22058,did not fit right,22058,2,1
154,22059,Definitely not what I expected for the price!!,22059,2,3
155,22059,I would say this is a $4.95 item at the most!,22059,2,-1
156,22059,"I must have paid for the ""free"" shipping on this item and it was poorly packaged just in a plastic mailing bag...",22059,2,0
157,22060,"to large in the boob area, the straps where placed in the wrong position for this to work properly.",22060,2,1
158,22060,and the lace over the boob section is already coming unstitched and i have not even wore it yet.,22060,2,3
159,22060,If these things were corrected it would be a great top.,22060,2,-1
160,22061,"Because the fit was too small (and I ordered a size larger than my normal), the shirt would curl/ride up when I moved in it.",22061,2,1
161,22062,"Runs small, not as cute in person",22062,2,1
162,22063,Fits exactly as I would expect any normal shirt to fit.,22063,2,1
163,22063,"Material is very synthetic, scratchy, and thin.",22063,2,3
164,22064,"This skirt had so many good reviews, I decided to try it.",22064,2,-1
165,22064,I didn't like it.,22064,2,-1
168,22064,"I bought it to wear in hot weather, but the material is not breathable at all.",22064,2,3
169,22064,The shape is also not as pictured - mine poofed out right under the belt line and went straight down like a brick.,22064,2,1
170,22064,Same diameter at the hips as at the knees looks very square.,22064,2,1
171,22064,"The pattern was pretty, but I returned it.",22064,2,2
172,22064,"Thankfully, no issues with return.",22064,2,3
173,22065,Part of the belt fell off the second time I wore it.,22065,2,3
174,22065,The only reason I'm giving it 2 stars is because it held my pants up.,22065,2,-1
175,22066,hard to move arms without exposing myself,22066,2,1
176,22067,"After reading the size chart and carefully choosing what was meant to be a size twelve to fourteen I ordered this what I received was about half that size, in fact if was tight on my sister who is a size six.",22067,2,1
177,22067,With the annoyance of returning things I chose just to give it to her.,22067,2,-1
178,22068,"I purchased ""this hat"" almost exactly 1 year ago.",22068,2,-1
179,22068,That was a 5 star purchase...,22068,2,-1
180,22068,I loved it but after many washes and my toddler getting his hands (and teeth) on the velcro it stopped holding well so I decided to buy another.,22068,2,3
181,22068,I noticed the price had gone up by a few dollars but figured it was a great hat so I'd go ahead and get a new one anyway.,22068,2,-1
182,22068,"I used the ""Buy it again"" button, verified that it was the same hat as before and clicked purchase.",22068,2,-1
183,22068,Quite disappointed with the had that showed up.,22068,2,-1
184,22068,"It is smaller in both brim and fit, the ventilation holes are no longer metal but wrapped in thread.",22068,2,1
185,22068,I'll keep it as a backup or something but will probably be stitching new velcro onto my other one since it actually fits and feels better.,22068,2,3
186,22069,Didn't like the way it looked too small,22069,2,1
187,22070,If you are a size LARGE and UP...just a warning.,22070,2,1
188,22070,The back of the material is white...and the more it stretches...the lighter they get.,22070,2,3
189,22070,Looked HORRID on me.,22070,2,-1
190,22070,"If you are Medium or smaller, very cute.",22070,2,1
191,22070,Find these printed tights with a BLACK background and you will be good!,22070,2,2
192,22070,ASK BEFORE YOU BUY.,22070,2,-1
193,22072,Never use it any more.,22072,2,-1
194,22072,"maybe im just fatter than i thought, but i got a size large and it feels like a snake is trying to squeeze me to death.",22072,2,1
195,22074,I really wanted to love this bag.,22074,2,-1
196,22074,The zipper broke the first time I used it.,22074,2,3
197,22074,The quality otherwise was what you'd expect for the price.,22074,2,3
198,22074,It was a little small for what I had in mind.,22074,2,1
199,22074,"It's not quite big enough for an overnight bag, but is similar in size to a diaper bag.",22074,2,1
200,22074,The refund was quick and painless.,22074,2,-1
201,22075,Large is more like a small!,22075,2,1
202,22076,The material was very thin and size runs very small.,22076,2,1
203,22076,"I'm currently 28 weeks pregnant, 155 lbs, 5'3"" and size 10 was way too small.",22076,2,1
204,22076,I would probably fit in size 14.,22076,2,1
205,22077,Somehow it wasn't what I expected.,22077,2,-1
206,22077,It's really bright and loud.,22077,2,2
207,22077,I thought the gold would be soft.,22077,2,2
208,22079,cheap materials.. you can only wear once or twice .. then it becomes put-me-in-trash condition... don't buy it!,22079,2,3
209,22080,I'm a small person skirt is to big zipper giving problems  I'm not pleased it Cost more to return than to buy,22080,2,1
210,22081,It looked like a giant piece of cloth.,22081,2,1
211,22081,Not right at all.,22081,2,-1
212,22081,Not even very warm.,22081,2,3
213,22082,"As a collegiate powerlifter I work out quite often and lift weights, so I have some muscle on my arms.",22082,2,-1
214,22082,This shirt fits great over my torso but the arms are quite small.,22082,2,1
215,22082,This makes wearing the shirt uncomfortable and look awkward because the sleeves can only slide up so far.,22082,2,1
216,22082,I would recommend this to someone who is slender and does not have muscular or larger than average arms.,22082,2,1
217,22084,It's cute but huge,22084,2,1
218,22085,The shirts see through.,22085,2,3
219,22085,.make sure to wear a top underneath.,22085,2,-1
220,22086,"One bunny (ball) is fixed onto the bar, and one broke off, so I can't even wear them (will glue it back on).",22086,2,3
221,22086,"I like to soak my jewelry in peroxide while I take a shower, so I don't feel like they are getting a good clean with one ball fixed.",22086,2,-1
222,22086,"The ears are also too heavy, causing the bunnies to flop dow and stick out.",22086,2,3
223,22086,"Also, be careful not to tighten too far because the screw threads will eventually become uneven and the bunnies will not lay the same.",22086,2,3
224,22087,"My suit fit perfectly, but arrived with a hole in the center of it  The material is very thin.",22087,2,1
225,22088,"It is short, it is small than expected and was not at all what I had hoped.",22088,2,1
226,22088,I will probable donate this dress to a second hand shop.,22088,2,-1
227,22089,"While the shoulder and hip width were the correct size, the length was WAASYYYY to short.",22089,2,1
228,22089,"I am petite and have a short body, but this was ridiculous.",22089,2,1
229,22089,I had the mega wedgie from hell!,22089,2,1
230,22089,Do not buy from this seller.,22089,2,-1
231,22089,"I bought two others from other sellers, and they fit fine all around.",22089,2,1
232,22090,didnt like them in comparison to saxx kinetic boxers.,22090,2,-1
233,22090,"these r much lighter and ride up ., Kinetic much better choice",22090,2,3
234,22091,thick OK material... didn't like the fit.. to loose and short...,22091,2,1
235,22092,We weren't thrilled with the way these sandals fit...they're like little stiff boards for baby feet!,22092,2,1
236,22092,They also fit pretty large on our 6 month old...I so wish they for better!,22092,2,1
237,22094,not enough support for the girls.,22094,2,-1
238,22095,"It's a very cute coat but definitely not bright yellow as pictured, more of a yellow ochre.",22095,2,2
239,22096,Was not as sheer as it looked in the pic.,22096,2,2
240,22096,Way too much sequin for me...looked like something for someone older...like in their 50's.,22096,2,2
241,22096,Definitely not something to wear with a material that pulls easily...it will mess it up.,22096,2,3
242,22097,"These were cute because they were DISNEY.....however, material is flimsy and not top quality, for sure.",22097,2,3
243,22097,"Stitching was irregular, collar trim was sloppy, no attention to detail.",22097,2,3
244,22098,Very pretty necklace but only got to wear it once.,22098,2,-1
245,22098,Was going to wear it a second time but the chain broke when I was putting it on.,22098,2,3
246,22099,"The skirt was well made, but I found the style to be more attractive on the hanger than on me.",22099,2,-1
247,22099,The fabric is thick and satiny and the pleats are fairly stiff so it stands out around your hips.,22099,2,3
248,22099,"Also, in person I found the cat heads disconcerting rather than cute.",22099,2,-1
249,22100,The small size fits like an XS.,22100,2,1
250,22101,Do not buy if you are over 5 ft 5.,22101,2,1
251,22101,"I'm 5'9"" and it didn't reach past my hips.",22101,2,1
252,22102,The skirt was too small.,22102,2,1
253,22102,I have three Style J skirts and this one was way tooo small.,22102,2,1
254,22102,I returned the skirt.,22102,2,-1
255,22103,The product is very well made.,22103,2,3
256,22103,Only thing is that the size chart indicated was not accurate.,22103,2,1
257,22103,They run about two sizes too small.,22103,2,1
258,22103,"Though I know they are to fit tight,  it was no where near it would close.",22103,2,1
259,22104,Fit small.... Get a bigger size or you going waste your money.....,22104,2,1
260,22106,I need to return for an exchange.,22106,2,-1
261,22106,"Also, the neckline of the tee is unusually large.",22106,2,1
262,22106,looks like it's been stretched out.,22106,2,3
263,22107,"It itches my ears, nice design though",22107,2,3
264,22108,"Incomplete stitching, needs repair before use.",22108,2,3
265,22109,"Hat listed said it was made in the United States, however the hat I received was made in China.",22109,2,0
266,22110,Will be returning this.,22110,2,-1
269,22110,Very disappointed as I really liked the watch in the picture.,22110,2,2
270,22110,"The watch did not work out of the box, so I tried to change the battery.",22110,2,-1
271,22110,"Without instructions, it was difficult.",22110,2,-1
272,22110,One has to be very dexterous in order to accomplish the task.,22110,2,-1
273,22110,"After I changed the battery, I discovered that the minute and second hand were stuck together, and when I tried to gently separate them, all the hands fell off.",22110,2,3
274,22112,The material was irritating and the dress was too short.,22112,2,3
275,22112,It fit on the upper  part but the bottom wasn't flattering.,22112,2,1
276,22113,These run very small.,22113,2,1
279,22113,Ignore the size chart order a size or 2 larger for USA women....if I knew it  was  coming from China I would have  ordered a larger size.,22113,2,1
280,22113,I just  requested a refund ..I'll see what happens,22113,2,-1
281,22114,The dress does not look like the photo,22114,2,2
282,22115,Did not fit well at all and the material was very uncomfortable.,22115,2,-1
283,22116,The fit is awkward.,22116,2,1
285,22116,Would not buy again.,22116,2,-1
300,22117,Too short and too tight,22117,2,1
301,22118,And I knew by the price it would not be the best quality- and also by the reviews that it would run small .,22118,2,1
302,22118,I ordered a large and it barely fit as a size 6.,22118,2,1
303,22118,I reordered an XL.,22118,2,1
304,22118,It came with an XL tag but fit exactly the same as the large.,22118,2,1
305,22118,How do I get my money back from China?,22118,2,-1
306,22119,"Thick and inconvenient...looks like it is not as was advertised, shipped another item..",22119,2,3
307,22120,"Ok, so...this swimsuit is cute.",22120,2,2
308,22120,"The top seems to be of good quality but, the Mermaid shorts/tail are very cheaply made.",22120,2,3
309,22120,My daughter wore this for a week and part of the shorts have turned all black.,22120,2,2
310,22121,"Low quality, cute gift for a child though at this price point.",22121,2,3
311,22122,it does not keep the squirrels out of my garden.,22122,2,-1
312,22122,i have tried on all settings.,22122,2,-1
313,22123,I returned the product.,22123,2,-1
316,22124,"Bought the ""green pebble"" one thinking it would be a nice evergreen color like in one of the highlighted reviews...Nope I opened it and saw this muted brown-green color that looks ugly.",22124,2,2
317,22124,Great interior though with the card slots.,22124,2,3
318,22125,Hard to free money from the clip.,22125,2,-1
319,22125,"Disappointed,especially for the cost",22125,2,-1
320,22126,"Not american sizing, and even when ordered larger did not fit",22126,2,1
321,22127,Way too small and if you wear any pant over size 6 you will look ridiculous.,22127,2,1
322,22128,"too long to deliver, poor quality run small.",22128,2,0
323,22129,Ordered a large and it was the size of a small shirt.,22129,2,1
324,22131,"It came on time and as described , HOWEVER it broke in 2 weeks .",22131,2,-1
325,22131,The straps slowly started to brake one by one until the straps came off completely.,22131,2,3
326,22131,"the zipper doesn't work well , itll only zip some of it and both zippers popped off .",22131,2,3
327,22131,the outside pockets on the side (black) made bigger holes if you put any pens/pencils in it,22131,2,3
328,22132,It runs very small.,22132,2,1
330,22132,It is also very short.,22132,2,1
331,22132,I bought this item twice and it still didn't fit.,22132,2,1
332,22132,The material is very nice and it is a pretty dress.,22132,2,3
333,22132,Wishes they ran in much bigger sizes.,22132,2,1
334,22133,Good design however way to small evenif an xxl is ordered,22133,2,1
335,22135,"Way too small, and the fabric is much thinner than I was expecting.",22135,2,1
336,22136,Design ruined by their cheesy logo stuck in an awkward spot.,22136,2,2
337,22137,"They hurt my feet, i had to return them.",22137,2,1
339,22138,Received 4 red mittens instead of the 6 color variety as promised and outlined in listing.,22138,2,-1
340,22138,Seller originally was communicating with me on getting me the missing mittens but has since gone radio silent.,22138,2,0
341,22138,I would not recommend this item if you are expecting 6 different colors.,22138,2,-1
342,22139,"Although the size and measurements were what I needed, It was much smaller than I expected...sleeves were very snug, and could barely pull i over my chest.",22139,2,1
343,22139,I guess the cut was a bit off.,22139,2,1
344,22139,"I will use it for a gift as it is too small for me and the XL is only slightly bigger, so it will be snug as well.",22139,2,1
345,22139,"will not order from this merchant unless I drop 30  pounds, which is unlikely",22139,2,1
346,22140,"Way too small, it's cute though,  I wish it fit.",22140,2,1
347,22141,I bought a couple of these two of them broke as soon as we put them on,22141,2,3
348,22142,These were 18g and they were about 12mm wide.,22142,2,1
349,22142,They were too big on my nose and I down sized to 20g.,22142,2,1
350,22143,I was excited to receive my socks then I noticed the socks weren't the same color as they are in the picture.,22143,2,2
351,22143,They are a light green instead on a darkish green.,22143,2,2
352,22143,The light green ends up making the socks look very weird.,22143,2,2
353,22144,Product seems we're very messed up - sending back!,22144,2,-1
